"Cleric Who Died in Pakistan Custody  #39;Tortured #39; ISLAMABAD (Reuters) - An Afghan Islamic cleric who died in custody in Pakistan on Wednesday had signs of torture on his body, an intelligence official said. ",0,World
"Google Slashes IPO Price UPDATED: Search engine darling Google (Quote, Chart) has slashed the price of its long-awaited public offering by about 30 percent to between \$85 and \$95 per share and plans to sell fewer shares. ",2,Business
"Janus Loses \$5 Billion The bad news just keeps pouring in for mutual fund manager Janus Capital Group (NYSE: JNS). Yesterday, the Denver-based firm reported that European banker ING Group (NYSE: ING) will pull \$5 billion from its mutual funds, or ...",2,Business
"Parmalat sues Grant Thornton, Deloitte for \$10 billion CHICAGO Italian dairy company Parmalat today filed a ten (B) billion dollar lawsuit against two auditors it accuses of overlooking fraud that nearly led to the company #39;s downfall. ",2,Business
"Is Applied Materials Losing Momentum? Despite a strong third-quarter performance from Applied Materials (Nasdaq: AMAT), a weaker fourth-quarter outlook has the chip equipment maker #39;s shares treading water today. ",2,Business
"McDonald #39;s to use cashless payment system TORONTO, Aug. 18  McDonald #39;s restaurants has announced an agreement to accept MasterCard PayPass, a new  quot;contactless quot; payment option utilizing radio frequency technology at select McDonald #39;s restaurants in the United States. Participating McDonald #39;s ...",2,Business
"Update 1: Vivendi, Messier Are Fined \$1.35 Million Vivendi Universal and its former chief Jean-Marie Messier have each been fined 1 million euros (\$1.35 million) for misleading financial information issued by the company when Messier was in charge, Messier #39;s lawyer said Tuesday.",2,Business
"Tiffany sells stake in Aber Diamond, discount arrangement ends TORONTO (CP) - US jewelry retailer Tiffany  amp; Co. has sold its nearly 14 per cent stake in Aber Diamond Corp., part owner of Canada #39;s second diamond mine, Diavik.",2,Business
"SEC Says Google IPO Document Effective  WASHINGTON (Reuters) - The U.S. Securities and Exchange  Commission said on Wednesday that it declared effective Google  Inc.'s &lt;A HREF=""http://www.investor.reuters.com/FullQuote.aspx?ticker=GOOG.O target=/stocks/quickinfo/fullquote""&gt;GOOG.O&lt;/A&gt; registration statement for its initial public  offering.",2,Business
"Australian City Agency Switches to Sun's StarOffice (Ziff Davis) Ziff Davis - In another blow to Microsoft, a government agency in New South Wales, Australia, signs a deal with Sun to migrate 1,500 users to the company's StarOffice productivity suite and Messaging products.",3,Sci_Tech
Ford scraps Oracle-based procurement system Automaker dumps Everest procurement system to revert to older technologies.,3,Sci_Tech
Briefly: Mozilla makes Japanese push roundup Plus: Macromedia offers Flash video tool...UTStarcom wins Indian IP gear contract...Microsoft tightens Windows-mainframes link.,3,Sci_Tech
Pros point to flaws in Windows security update German security company says it found minor problems in SP2; researchers predict more critical issues will emerge.,3,Sci_Tech
"Sears launches consumer electronics line Department store selling projection TVs via Web; will offer them in stores in the fall, with other devices to follow.",3,Sci_Tech
"Wireless sensor networks looking to Zigbee Alliance Imagine a golf course that can sense rainfall, and adjust the automatic sprinkler system to delay a scheduled watering session or focus on parts of the course that didn't get as much rain as others. Or a hotel that can detect when a room is vacant, and turn off the heating or cooling systems in that room to save energy.",3,Sci_Tech
"Web Surfers Hit Higher Speeds The majority of Internet users in the U.S. have ditched dial-up, survey says.",3,Sci_Tech
"Microsoft Outlook Tool Launched by You Software You Looking For Another Microsoft Outlook Tool\\Microsoft gobbled up Lookout the other week, an Outlook search tool, but You Software is introducing another option to finding one's way around Outlook - You Perform.\\With hundreds of millions of users around the world, Microsoft Outlook is the standard for business e-mail. One ...",3,Sci_Tech
"Hamm Wins All-Around Gymnastics Title (AP) AP - After falling onto the edge of the judges' table on the landing of his vault, Paul Hamm performed two of the most spectacular routines of his career to win the men's all-around gymnastics title by the closest Olympic margin ever.",1,Sports
"Judge in Bryant Case Loosens Gag Order (AP) AP - The judge in the Kobe Bryant sexual assault case has loosened a sweeping gag order after objections from prosecutors, news organizations and attorneys for the accuser.",1,Sports
"Bulluck Picks Super Bowl Shot Over Cash (AP) AP - Keith Bulluck knows his answer to the question of how much is enough. Coming off his first Pro Bowl and All-Pro season, the Tennessee linebacker could have played out the final year of his contract then become a free agent in search of more money. Instead, he signed a six-year,  #36;36 million contract in March and remained a Titan.",1,Sports
American Hamm Claims Men's Gymnastics All-Round Crown  ATHENS (Reuters) - Paul Hamm became the first American man  to claim the Olympic gymnastics men's all-round gold medal on  Wednesday.,1,Sports
"UPDATE 1-Citigroup fined over risky fund recommendations The brokerage watchdog NASD on Tuesday censured Citigroup Inc. (CN: Quote, Profile, Research) and fined the financial services company \$275,000 for violating rules regarding sales of risky investments.",2,Business
"UN food agency steps up Sudan aid as rainy season approaches (Canadian Press) Canadian Press - KHARTOUM, Sudan (AP) - The United Nations' food relief agency is gearing up for a ""critical stage"" in feeding refugees in western Sudan as more people flee ethnic violence there and the rainy season peaks, UN officials said Wednesday.",0,World
"Iraq Cleric Agrees End Uprising, Fighting Continues  NAJAF, Iraq (Reuters) - A radical Iraqi cleric leading a  Shi'ite uprising agreed Wednesday to disarm his militia and  leave one of the country's holiest Islamic shrines after  warnings of an onslaught by government forces.",0,World
SA soldiers 'robbed immigrants' Five soldiers appear in court in South Africa accused of robbing Zimbabwean deportees.,0,World
"Israel 'hits' Gaza City targets An Israeli helicopter fires two missiles at targets in Gaza City, Palestinian witnesses say.",0,World
"Paul Hamm Wins All-Around Event After falling on the landing of his vault, Paul Hamm put on two of the most spectacular routines of his career to win Olympic gold, the first ever by a U.S. man.",0,World
"Al-Sadr OKs Plan to End Fighting in Najaf NAJAF, Iraq - Radical Shiite cleric Muqtada al-Sadr accepted a peace plan Wednesday for Najaf that would disarm his militiamen and remove them from a holy shrine where they are hiding out, according to a spokesman. However, Al-Sadr wanted to negotiate how the deal would be implemented...",0,World
"SEC Gives Final Nod to Google's IPO SAN JOSE, Calif. - The Securities and Exchange Commission granted final approval Wednesday to the paperwork required for Google Inc.'s initial public offering, paving the way for the Internet search giant to set a price for its shares and begin selling them after several stumbles and a last-minute downward revision on the size of the offering...",0,World
"Hamm Wins All-Around Gymnastics Title ATHENS, Greece - After falling onto the edge of the judges' table on the landing of his vault, Paul Hamm performed two of the most spectacular routines of his career to win the men's all-around gymnastics title by the closest Olympic margin ever.    Needing a 9.825 on high bar, his best event, to tie Kim Dae-eun of South Korea for gold, Hamm was dazzling...",0,World
"Colgate to Cut About 4,400 Jobs Colgate-Palmolive Co. (CL) will cut about 4,400 jobs and close a third of its factories under a program aimed at fighting rising costs and focusing on higher-profit areas such as oral care, the company said on Tuesday.",2,Business
"Lamy Strong Candidate for WTO Job-USTR  WASHINGTON (Reuters) - U.S. trade officials said on Tuesday  that former European Union Trade Commissioner Pascal Lamy would  be a ""strong candidate"" to lead the World Trade Organization,  but stopped short of formally endorsing him.",2,Business
"Stocks Close Higher, Dow Above 10,000  NEW YORK (Reuters) - U.S. stocks ended higher on Wednesday,  as investors shrugged off record crude oil prices and bought  beaten-down shares, pushing blue chips to close above 10,000  for the first time in 2 weeks.",2,Business
"CORRECTED: Charley Shows Progress, Pitfalls in Forecasting (Reuters) Reuters - A few decades ago, the earliest warning\Floridians would have had of a hurricane would have been black\clouds on the horizon. Now people are complaining after\Hurricane Charley hit shore at a point just 60 miles off from\the track projected by meteorologists.",3,Sci_Tech
"Oracle intros Business Intelligence 10g Oracle today introduced the latest version of its Business Intelligence product which combines information access, analysis, reporting, data integration and management tools into a standalone application.",3,Sci_Tech
"Mozilla Sparks New Fire with Thunderbird E-Mail Client Thunderbird is touting its new features, like RSS news and blog reader integration into its e-mail client. Users can scan and sort through hundreds of headlines.",3,Sci_Tech
"Sony Announces PS3 GPU December 07, 2004 - In an announcement made around the midnight hour earlier this morning, Sony Computer Entertainment and NVIDIA Corporation jointly confirmed that they have teamed up to create the graphics chip for Sony #39;s next videogame console.",3,Sci_Tech
"United, American OK flight caps to ease airport gridlock CHICAGO : United Airlines and American Airlines have agreed to temporary flight caps at Chicago #39;s O #39;Hare International Airport to ease congestion at one of the world #39;s busiest hubs, federal officials said. ",2,Business
"Stocks End Higher, Dow Back Above 10,000 NEW YORK (Reuters) - US stocks ended higher on Wednesday, as investors shrugged off record crude oil prices and bought beaten-down shares, pushing blue chips to close above 10,000 for the first time in 3 weeks. ",2,Business
Cause of shopping center fire in South Everett under investigation EVERETT  Fire investigators are still trying to determine what caused a two-alarm that destroyed a portion of a South Everett shopping center this morning. ,2,Business
"BigFix eases enterprise deployment of SP2 BigFix, an enterprise security vendor, announced yesterday that its BigFix Enterprise Suite  quot;supports and simplifies quot; the deployment of Windows XP Service Pack 2 (SP2). ",3,Sci_Tech
"Web Surfers Hit Higher Speeds A majority of US home Internet users now have broadband, according to a survey by NetRatings. While the total number of home Internet users has reached a plateau in the US, those who do use the Internet are adopting broadband at a rapid pace, according to ...",3,Sci_Tech
"Compuware Calls for IBM Oust Lawyers for software vendor Compuware (Quote, Chart) filed a motion with a US District Court in Michigan asking a federal judge to impose sanctions against IBM for producing source code two years too late. ",3,Sci_Tech
White House Touts High-End Computing In R amp;D Budgets It #39;s instructing executive-branch heads to give priority to supercomputing and cyberinfrastructure research and development in their fiscal 2006 budgets. ,3,Sci_Tech
"Greek sprinters withdraw from Olympics ATHENS -- The final curtain fell Wednesday on a week-long drama that has riveted this nation when Greece #39;s two top sprinters, swept up in a suspected doping scandal, withdrew from the Summer Olympics and competitions that might have ...",1,Sports
"Olympics : Japan #39;s Kitajima completes breaststroke double ATHENS : Kosuke Kitajima completed a sweep of Olympic breaststroke gold on Wednesday, capturing the 200m title in a Games record ahead of Hungarian teenager Daniel Gyurta. ",1,Sports
"Calls for Sadr militia to disarm NAJAF, Iraq (Reuters) - Iraq #39;s Defence Ministry has ordered Shi #39;ite militiamen in Najaf to immediately lay down their weapons and leave a holy shrine in the city. ",0,World
"More Georgian Soldiers Die in South Ossetia Clashes Georgian officials reported four Georgian soldiers were killed in a heavy fighting, which erupted in the South Ossetian conflict zone late on August 18. ",0,World
"Riot in Salvadoran jail leaves 20 dead, 30 injured MEXICO CITY, Aug. 18 (Xinhuanet) -- A bloody riot Wednesday in the La Esperanza Jail, in Mariona, in the outskirts of San Salvador, left a toll of at least 20 dead and another 30 injured. ",0,World
"Intuit Posts Wider Loss After Charge  SAN FRANCISCO (Reuters) - Intuit Inc. &lt;A HREF=""http://www.investor.reuters.com/FullQuote.aspx?ticker=INTU.O target=/stocks/quickinfo/fullquote""&gt;INTU.O&lt;/A&gt;, maker of  the No. 1 U.S. tax presentation software TurboTax, on Wednesday  posted a wider quarterly loss from a year earlier after taking  a goodwill impairment charge during its seasonally weaker  fourth quarter.",2,Business
"Software Vendor Lindows Postpones IPO (AP) AP - Software vendor Lindows Inc. formally postponed its initial public offering Wednesday, citing adverse market conditions.",3,Sci_Tech
"Spruced up 64-bit Windows beta ready Microsoft on Wednesday made available the latest builds of its 64-bit version of Windows XP Professional and Windows Server 2003 Enterprise, that each features a handful of new improvements including the Luna user interface, Windows Messenger, Windows Media Player, infrastructure support for Bluetooth, and the .Net Framework 1.1.",3,Sci_Tech
"Dollar Up a Bit Against Europe Currencies  NEW YORK (Reuters) - The dollar was a little stronger  against the main European currencies but weaker against the yen  on Wednesday, with the Japanese currency rallying across the  board as dealers adjusted positions.",2,Business
Google Faces Another Keyword Lawsuit Google Faces Another Keyword Lawsuit\\Another lawsuit has been filed against Google because of the trademarked keyterms that companies bid for in the AdWords keyword advertising program.  Next week Google will head over to a German courtroom where it will continue to defend its technology against Metaspinner Media GmbH.\,3,Sci_Tech
"Ogunleye Remains Idled in Contract Talks (AP) AP - Idled by a stalemate in contract negotiations, Pro Bowl defensive end Adewale Ogunleye can only wonder where he'll be come September.",1,Sports
Portugal Suffers Humiliating Athens Exit in Soccer  ATHENS (Reuters) - Portugal were bundled out of the men's  soccer tournament at the Athens Olympics on Wednesday after a  humiliating 4-2 defeat by Costa Rica.,1,Sports
"Iraq Cleric Agrees to End Uprising, Fighting Rages On  NAJAF, Iraq (Reuters) - A radical Iraqi cleric leading a  Shi'ite uprising agreed on Wednesday to disarm his militia and  leave one of the country's holiest Islamic shrines after  warnings of an onslaught by government forces.",0,World
"Argentina to tackle tax 'evaders' The government of Buenos Aires, the richest province of Argentina, says it wants to seize the safety deposit boxes of 35,000 alleged tax debtors. ",2,Business
"SEC Gives Final Nod to Google #39;s IPO SAN JOSE, Calif. Aug. 18, 2004  The Securities and Exchange Commission granted final approval Wednesday to the paperwork required for Google Inc. #39;s initial public offering, paving the way for the Internet search giant to set a price for its shares and ...",2,Business
"O #39;Hare Set to Lose 37 Daily Arrivals Federal officials announced an agreement Wednesday to ease congestion at O #39;Hare International Airport by temporarily cutting 37 daily peak-hour arrivals by United Airlines and American Airlines, its two largest carriers. ",2,Business
"Moody #39;s raises Dell #39;s senior unsecured debt rating NEW YORK, Aug 18 - Moody #39;s Investors Service said on Wednesday it raised the senior unsecured debt rating of Dell Inc. (DELL.O: Quote, Profile, Research) with a stable outlook citing the firm #39;s strong balance sheet and solid operating and financial ...",2,Business
"Roddick, Williams lose in third round Maybe all that talk from Andy Roddick and Venus Williams about taking the Olympics as seriously as a Grand Slam was just that: talk. ",1,Sports
"Hamm stumbles, then soars to gold ATHENS, Greece -- Paul Hamm overcame a fall on the vault to become the first American to win an Olympics men #39;s all-round gymnastics gold medal. ",1,Sports
Aussie equestrian hopes end in sixth Australia #39;s dreams of an historic fourth successive three-day eventing gold medal ended in disappointment but there was still joy for the team when Andrew Hoy #39;s wife won dual gold medals. ,1,Sports
"Arafat #39;s familiar words must lead to unfamiliar actions If there are any democratic  quot;T #39;s quot; to be crossed and  quot;I #39;s quot; to be dotted, Palestinian President Yasser Arafat did not leave one undone during his keynote speech to MPs at his West Bank headquarters in Ramallah. Arafat looked rejuvenated and emphatic as he ...",0,World
"Salvadoran Prison Riot Kills at Least 20 Prisoners, EFE Reports August 18 (Bloomberg) -- A prison riot in the Central American nation of El Salvador killed at least 20 prisoners and wounded another 30, the Spanish news agency EFE reported, citing prosecutors. ",0,World
PM denies misleading public PRIME Minister John Howard is insisting he has not deliberately misled the Australian public over the children overboard affair. ,0,World
Southern Africa: Zim Election Group Welcomes SADC Guidelines The Zimbabwe Elections Support Network (ZESN) has welcomed the adoption of guidelines for holding democratic elections at the Southern African Development Community (SADC) summit in Mauritius this week. ,0,World
"Vivendi, Messier Each Fined EU1 Million by French Regulator Jean-Marie Messier, the former chief of Vivendi Universal SA who is under investigation for alleged fraud and stock manipulation, was fined 1 million euros (\$1.3 million) by French regulator Autoritee des Marches Financiers.",2,Business
"Lenovo may be in acquisition talks with IBM HONG KONG - China #39;s biggest computer maker said Tuesday it is in acquisition talks with a major international technology company, a disclosure which comes amid reports it might buy IBM Corp.",2,Business
"Google Slashes IPO, Gets Pricing Go-Ahead  NEW YORK/SAN FRANCISCO (Reuters) - Google Inc. &lt;A HREF=""http://www.investor.reuters.com/FullQuote.aspx?ticker=GOOG.OQ target=/stocks/quickinfo/fullquote""&gt;GOOG.OQ&lt;/A&gt; on  Wednesday got the green light to go ahead with a downsized  version of its much-hyped initial public offering, meaning its  shares could debut on Nasdaq as soon as Thursday.",2,Business
"Product Review: Business PC Roundup - Part 2 (NewsFactor) NewsFactor - Over the last several weeks, NewsFactor has looked at ten of the market's best-known and most sought-after business computers. Each has its strengths and weaknesses. The difficult part is finding the one that strikes the best balance between merits and flaws.",3,Sci_Tech
Analyst: CRM Mergers and Acquisitions Picking Up (NewsFactor) NewsFactor - Most industry observers agree that the CRM-software market is picking up speed this year and will continue to do so next year. And most also agree that venture capitalists have been waiting for several years to make their next moves regarding the startups they have backed through the thin years.,3,Sci_Tech
"Vitamin E Thwarts Colds in the Elderly By Amanda Gardner, HealthDay Reporter    HealthDayNews -- Nursing home residents who take daily doses of vitamin E appear to be less likely to develop certain respiratory infections, a new study finds.    The protective effect was most pronounced with upper respiratory infections, such as the common cold...",3,Sci_Tech
"Ford kills 'Everest' procurement software system Ford Motor Co. has decided to stop work on a major procurement software system built around Oracle's 11i E-Business Suite of apps and plans to move back toward its original custom-written, mainframe-based applications.",3,Sci_Tech
"NetRatings survey shows broadband users now a majority in U.S. There were an estimated 63 million broadband users, or 51 of all home Internet users, last month compared with 61.3 million dial-up users, 49 of the total, according to a survey by NetRatings Inc.",3,Sci_Tech
Brief: FedEx Kinko's launches Internet-based print options FedEx Kinko's yesterday launched a Web-based tool geared toward mobile professionals and small businesses that allows Microsoft Windows users to connect to FedEx Kinko's printing centers.,3,Sci_Tech
"Sun postpones September user show In a bid to save money, Sun Microsystems is postponing its SunNetwork 2004 San Francisco user conference and may merge the event with its JavaOne 2005 developer conference, set for next June.",3,Sci_Tech
Researchers find holes in XP SP2 Security researchers found two software flaws in the Windows XP Service Pack 2 that could allow virus writers and malicious hackers to sidestep new security features in the operating system.,3,Sci_Tech
"HP pledges to correct order processing problems At HP World this week, company officials scrambled to reassure customers that it is working hard to fix its order processing problems by the end of this month.",3,Sci_Tech
"Catching 'gotchas' in tech contracts IT managers and contract specialists often fail to include important criteria in final tech deals, such as performance promises made by vendors during the request for proposals process, said negotiation experts at an IBM Share conference.",3,Sci_Tech
"Netscape 7.2 released Netscape Communications yesterday released Netscape 7.2, which is based on Version 1.7 of Mozilla, the most recent version of the Mozilla Internet application suite.",3,Sci_Tech
Brief: SAP users warned of false support calls SAP AG is warning customers not to provide confidential information on the phone to people claiming to be company support staff.,3,Sci_Tech
"Review: Robovacs No Match for Normal Vacuum Cleaners By MARK JEWELL     BOSTON (AP) -- A new generation of robotic vacuums is ready to do battle with dirt, dust and dog hair with more cleaning power and cunning than their ancestors could muster.     Faced with the usual obstacles - furniture, stairs, low-hanging bed skirts and stray socks - they intelligently and acrobatically extricate themselves from most tight spots and largely avoid getting stuck or sucking in what they shouldn't...",3,Sci_Tech
"Sharon's Likud Rejects Coalition Bid--First Returns (Reuters) Reuters - Israeli Prime Minister Ariel\Sharon's right-wing Likud party voted Wednesday to bar a\coalition with center-left Labor that he seeks to advance his\Gaza withdrawal plan, according to early returns.",0,World
"UN Concerned by Lack of Darfur Progress on Ground (Reuters) Reuters - The United Nations said on\Wednesday it was concerned by Sudan's lack of progress in\bringing security to Darfur, where more than a million people\have fled their homes for fear of militia attack.",0,World
"Sharon's Likud Rejects Coalition Bid--First Returns  TEL AVIV, Israel (Reuters) - Israeli Prime Minister Ariel  Sharon's right-wing Likud party voted Wednesday to bar a  coalition with center-left Labor that he seeks to advance his  Gaza withdrawal plan, according to early returns.",0,World
Medtronic Quarterly Net Up (Reuters) Reuters - Medtronic Inc. (MDT.N) on Wednesday\said its quarterly earnings rose on brisk demand for devices\that manage irregular heart beats and products used to treat\the spine.,2,Business
Google Says IPO Auction Has Closed  NEW YORK (Reuters) - Google Inc. said on Wednesday that the  auction has closed for its initial public offering.,2,Business
Bloom Will Appeal Latest NCAA Rebuff (AP) AP - Colorado wide receiver Jeremy Bloom decided Wednesday to keep fighting the NCAA for the right to accept commercial ski endorsements while playing college football.,1,Sports
"U.S. Forces Kill 50 Sadr Militia in Baghdad Suburb (Reuters) Reuters - U.S. forces killed more than 50 Shi'ite\militiamen Wednesday in a significant advance into a Baghdad\suburb that is a powerbase for radical cleric Moqtada al-Sadr,\the military said.",0,World
Besieging holy sites: past lessons The standoff at one of Islam's holiest shrines parallels one at the Church of the Nativity in 2002.,0,World
British say US gave terror suspects a heads up Eight alleged terrorists were charged in Britain this week. One was caught with detailed plans of several US buildings.,0,World
"IPO Quiet Period Needs  #39;Good, Hard Look #39; -SEC Chief WASHINGTON (Reuters) - The rules on what executives may and may not say during the run-up to launching a company onto the public markets need a  quot;good, hard look, quot; the top US securities regulator said on Wednesday. ",2,Business
"Crude oil crosses the \$47 per barrel mark NEW YORK, August 18 (New Ratings)  Crude oil prices reached new record high levels today, following the US Energy Department report regarding the expanded operations by the US refineries and increased gasoline demand for this year. ",2,Business
"Fleet Bank to lay off workers Hundreds of branch employees at Fleet Bank, one of the largest banks in Philadelphia and now part of Bank of America, are being laid off Wednesday across the Northeast. ",2,Business
"Intuit Posts Wider Loss After Charge SAN FRANCISCO (Reuters) - Intuit Inc. (INTU.O: Quote, Profile, Research) , maker of the No. 1 US tax presentation software TurboTax, on Wednesday posted a wider quarterly loss from a year earlier after taking a goodwill impairment charge during its ...",2,Business
