"Study: Global Warming Could Affect Calif. (AP) AP - Global warming could cause dramatically hotter summers and a depleted snow pack in California, leading to a sharp increase in heat-related deaths and jeopardizing the water supply, according to a study released Monday.",3,Sci_Tech
New Bird Species Found in Philippines (AP) AP - Filipino and British wildlife researchers say they've stumbled upon what appears to be a new species of flightless bird found only on the tiny forested island of Calayan in the northern Philippines.,3,Sci_Tech
Briefly: IBM chalks up two health care wins roundup Plus: Vonage users dial 311 for city info...Mozilla makes Japanese push...Macromedia offers Flash video tool.,3,Sci_Tech
Freddie Mac Says May Face SEC Action (Reuters) Reuters - Mortgage finance company Freddie\Mac (FRE.N) on Wednesday said it may face civil action from the\U.S. Securities and Exchange Commission for possible violations\of securities laws.,2,Business
"Freddie Mac Says May Face SEC Action  LOS ANGELES (Reuters) - Mortgage finance company Freddie  Mac &lt;A HREF=""http://www.investor.reuters.com/FullQuote.aspx?ticker=FRE.N target=/stocks/quickinfo/fullquote""&gt;FRE.N&lt;/A&gt; on Wednesday said it may face civil action from the  U.S. Securities and Exchange Commission for possible violations  of securities laws.",2,Business
GOP Incumbent Wins Wyo. Primary for House (AP) AP - Incumbent Republican Rep. Barbara Cubin easily fended off four GOP challengers to earn a shot at a sixth term in November's general election.,0,World
"SEC Gives the Thumbs Up to Google #39;s IPO Earlier Wednesday, Google cut the range of its IPO price to \$85-\$95 per share from \$108-\$135 per share and the number of shares that will be sold from 25.7 million to 19.6 million. The cuts mean Google could raise about \$1.8 billion in ...",2,Business
"AUSTRALIA PRESS: Murdoch Drums Up Support For US Move SYDNEY (Dow Jones)--News Corp. (NWS) Chairman Rupert Murdoch said there was  quot;no choice quot; but to change the media giant #39;s domicile to the US as he attempts to win over crucial support from Australian investors for the move, the Australian Financial Review ...",2,Business
"Delta CEO presents long-awaited plan to board CHICAGO, Aug 18 (Reuters) - Delta Air Lines Chief Executive Gerald Grinstein presented his long-awaited plan for the airline #39;s future to board members on Wednesday, a strategy that could determine whether the struggling carrier ...",2,Business
Parmalat Sues Grant Thornton and Deloitte Italian-based Parmalat is suing its former auditors -- Grant Thornton International and Deloitte Touche Tohmatsu -- for billions of dollars in damages. Parmalat blames its demise on the two companies #39; mismanagement of its finances. ,2,Business
"Broadband Reaches Critical Mass Nielsen//NetRatings is reporting that broadband connections for the first time reached 51 percent of the American online population at home during the month of July, as compared to 38 percent last July. Sixty-three million Web ...",3,Sci_Tech
"Compuware Blasts IBM #39;s Legal Tactics Two years ago, IBM was ordered to produce the source code for its products, which Compuware identified as containing its pirated intellectual property. The code was missing. But lo and behold -- last week, they called and said they had it, quot; ...",3,Sci_Tech
"A brighter Outlook? The start-up company made its retail debut Wednesday with You Perform, a collection of more than a dozen add-ons for Outlook, the widely used e-mail and calendar application included in Microsoft Office. ",3,Sci_Tech
"Five new moons for planet Neptune Five new satellites - and one candidate moon - have been discovered orbiting the giant planet Neptune, bringing its tally of moons to 13. ",3,Sci_Tech
"Ford Drops Oracle-based Purchasing System Ford Motor Co. on Wednesday said it has scrapped a 5-year-old project to move suppliers over to an Internet-based purchasing system powered by Oracle Corp. software, deciding instead to revert back to its custom-built system. ",3,Sci_Tech
"Pakistani firms answer call for cell phones Tens of thousands of Pakistanis endured hours of stifling heat this week to accept an offer of free mobile phone connections, a sign of the pent-up demand in a country where cell phone usage has remained low. ",3,Sci_Tech
"UPI NewsTrack Sports ATHENS, Greece, Aug. 18 (UPI) -- Paul Hamm produced an amazing comeback Wednesday night to become the first American male to win the Olympic gymnastics all-around gold medal. ",1,Sports
"Historic return but how much has it all changed? The occasion was clearly too much for Kristin Heaton, the first athlete for 1,611 years to compete at the original Olympic Games venue of Olympia. The American opened the women #39;s shot put competition yesterday, but could not ...",1,Sports
"England Beats Ukraine in World Cup Soccer Warm-Up (Update1) Aug. 18 (Bloomberg) -- Shaun Wright-Phillips scored in his international debut as England beat Ukraine 3-0 in a warm-up for soccer World Cup qualifying, while Italy lost 2-0 to Iceland. ",1,Sports
"Naked ambition finally earns reward for Williamson For eight years Alison Williamson has been all too aware that the only time she imposed herself on the national consciousness was when she posed nude for a glossy magazine. As of yesterday, she will be remembered as an Olympic bronze ...",1,Sports
Doubts over Sadr peace deal The radical Shia cleric Moqtada al-Sadr was reported last night to have accepted a peace deal that could end the violent two-week uprising in Najaf and see his militia leave the city #39;s Imam Ali Shrine. ,0,World
"Typhoon Megi claims six lives Heavy rains from Typhoon Megi pounded Shikoku island in western Japan, killing at least six people, the Mainichi Shimbus reported Wednesday. ",0,World
"Freddie Mac May Face SEC Civil Action  LOS ANGELES (Reuters) - Freddie Mac &lt;A HREF=""http://www.investor.reuters.com/FullQuote.aspx?ticker=FRE.N target=/stocks/quickinfo/fullquote""&gt;FRE.N&lt;/A&gt;, the No. 2 U.S.  mortgage finance company, on Wednesday said it may face civil  action from the U.S. Securities and Exchange Commission for  possible violations of securities laws.",2,Business
"IBM tightening Eclipse, Java, Linux links IBM on Thursday will announce the release of a free tools bundle for Eclipse to make it easier to deploy Java applications on Linux.",3,Sci_Tech
"Callahan Gets 'Fresh Start' With 'Huskers (AP) AP - Ten days after getting run out of Oakland, Bill Callahan walked into Lincoln and took over one of the nation's most high-profile college football programs. Time will tell whether it's a soft landing for the man who two years ago led the Raiders to the Super Bowl.",1,Sports
"Security aide says US will be stronger in Korea after troop withdrawal (AFP) AFP - US national security advisory Condoleezza Rice said that US military power on the Korean peninsula will be stronger even if 12,000 troops are withdrawn under a controversial troop withdrawal plan.",0,World
Oil soars above 47 on US supply jitters PARIS Oil prices climbed to another high on Wednesday after figures showed US crude supplies were down for a third straight week while a report from OPEC highlighted the threat of high oil prices for world economies. ,2,Business
Barclays set to purchase credit card company LONDON Barclays said Wednesday it would buy the US credit card company Juniper Financial for \$293 million as part of its international expansion plan. ,2,Business
Bank Of America Layoffs Effect Fleet Banks Employees Bank of America acquired Boston-based Fleet Financial Corporation last Spring -- promising at the time there would be no job cuts from the merger. ,2,Business
"Fuel surcharges grow LONDON Air France and its unit KLM Royal Dutch Airlines, as well as British Midland Airways, announced new fare surcharges on Wednesday as a result of higher fuel costs. They follow similar moves by British Airways and Deutsche Lufthansa. ",2,Business
Inflation slows across euro region BRUSSELS Inflation in the 12 countries sharing the euro slowed for a second month in July as faltering consumer demand deterred companies from passing on rising energy costs. But economists said higher oil prices may fuel a reversal of that trend as the ...,2,Business
"Microsoft delays upgrade REDMOND, Washington Microsoft has delayed the automated distribution of a major security upgrade to its Windows XP Professional computer operating system, citing a desire to give companies more time to test it. ",3,Sci_Tech
"Half of US web users use Broadband internet connection A small majority of US Internet users are connected with broadband service for the first time. 51 percent of home Internet connections are broadband services in July, according to a Nielsen/NetRatings report. ",3,Sci_Tech
"Mars Hills, Crater Yield Evidence of Flowing Water LOS ANGELES (Reuters) - The hills of Mars yielded more tantalizing clues about how water shaped the Red Planet in tests by NASA #39;s robotic geologist, Spirit, while its twin, Opportunity, observed the deep crater it climbed into two months ...",3,Sci_Tech
"Compuware asks court to sanction IBM An emergency motion was filed Friday the 13th of August in US District Court of Eastern Michigan, Compuware said that IBM failed to provide essential evidence, which includes several pieces of disputed software source code, until after the case #39;s ...",3,Sci_Tech
"Microsoft Previews 64-Bit XP, Promises No Price Hikes It posted a free beta version, and said the new edition would be priced at the same level as the 32-bit edition. ",3,Sci_Tech
"Less Outlook clutter with new add-on Toolkit You Software, a small Oregon based company, released a set of add-on tools for Microsoft Outlook, an e-mail client, on Wednesday. ",3,Sci_Tech
"Brazil hit Haiti for six in Peace Match PORT-AU-PRINCE, Aug 18 (Reuters) - Ronaldinho scored a hat-trick as world champions Brazil cantered to a 6-0 win over Haiti in a friendly dubbed the Peace Match on Wednesday. ",1,Sports
"Berlusconi shrugs off fears of new terror threat after Sardinia bomb scare Silvio Berlusconi brushed off fears yesterday of a fresh terrorist threat in Italy, insisting he would finish his holiday in Sardinia despite a bomb scare in the seaside town where Tony Blair ended a flying visit yesterday. ",0,World
"Death toll of Salvadoran jail riot rises to 30 MEXICO CITY, Aug. 18 (Xinhuanet) -- A riot taking place Wednesday at La Esperanza Jail, in Mariona, in the outskirts of El Salvador,left a toll of 30 dead and 28 injured, with six grenades exploding. ",0,World
Iraqi group threatens to kill missing journalist BAGHDAD - A militant group has released a video saying it kidnapped a missing journalist in Iraq and would kill him unless US forces left Najaf within 48 hours. ,0,World
"Medtronic Net Up on Higher ICD Sales  CHICAGO (Reuters) - Medtronic Inc. &lt;A HREF=""http://www.investor.reuters.com/FullQuote.aspx?ticker=MDT.N target=/stocks/quickinfo/fullquote""&gt;MDT.N&lt;/A&gt; on Wednesday  said its quarterly earnings rose on surprisingly brisk demand  for devices that slow racing heartbeats, offsetting a  weaker-than-expected performance in some of its other  businesses.",2,Business
"Shielding Your Skin From the Summer Sun Americans have a passion for the great outdoors but often seem downright lackadaisical about protecting their skin from the sun's damaging rays. Myths about sun exposure -- and there are quite a few -- may encourage people's risky behaviors, experts say.",3,Sci_Tech
"Health Highlights: Aug. 18, 2004 Here are some of the latest health and medical news developments, compiled by editors of HealthDay:    -----       Greek Athletes Who Missed Drug Test Quit Games      The two Greek athletes who missed a drug test on Aug. 12 have withdrawn from the Olympic Games...",3,Sci_Tech
"Google Gets IPO Go-Ahead After rocky road to public offering, search engine proceeds--but what will it do with its windfall?",3,Sci_Tech
"New Program Lets People Design 3-D Objects Programs for computer-aided design, or CAD, have been around for decades, but eMachineShop.com appears to be the first service that checks whether a design can be made, tells the customer how much it will cost. If the customer wants the item the design goes to a ""real world"" machine shop for manufacturing.",3,Sci_Tech
New Target Price Could Make Google a Bargain By MICHAEL J. MARTINEZ     NEW YORK (AP) -- The e-mail that popped into my inbox early Wednesday morning was the latest in a string of surprises in Google's long-awaited IPO...,3,Sci_Tech
Pakistan's Ruling Party Claims Win in Vote (AP) AP - The ruling party claimed victory Wednesday in special elections designed to clear the path for Pakistan's finance minister to be elevated to prime minister. The opposition said the vote was rigged.,0,World
Pope's French visit leaves debt France's Catholic Church posts a huge deficit after a weekend visit by the Pope to the southern shrine of Lourdes.,0,World
"Corzine Indicates He Will Not Seek Governorship of New Jersey Senator Jon S. Corzine said that Gov. James E. McGreevey had told him he was determined to hold office until Nov. 15, removing the possibility of a special election.",0,World
"Stocks Near Flat; J J Pressures Dow  NEW YORK (Reuters) - U.S. stocks were little changed on  Tuesday, with oil prices dropping below \$42 a barrel helping to  support markets, but Johnson   Johnson &lt;A HREF=""http://www.investor.reuters.com/FullQuote.aspx?ticker=JNJ.N target=/stocks/quickinfo/fullquote""&gt;JNJ.N&lt;/A&gt; put pressure on  the Dow following a report of a possible \$24 billion takeover  of cardiovascular device maker Guidant Corp. &lt;A HREF=""http://www.investor.reuters.com/FullQuote.aspx?ticker=GDT.N target=/stocks/quickinfo/fullquote""&gt;GDT.N&lt;/A&gt;.",2,Business
"Google Gets IPO Go-Ahead (PC World) PC World - After rocky road to public offering, search engine proceeds--but what will it do with its windfall?",3,Sci_Tech
"Bedrock in Mars' Gusev Crater Hints at Watery Past Now that NASA's Mars Exploration Rover Spirit is finally examining bedrock in the ""Columbia Hills,"" it is finding evidence that water thoroughly altered some rocks in Mars' Gusev Crater.",3,Sci_Tech
"Injuries Continue to Bedevil Cardinals (AP) AP - Arizona Cardinals defensive tackle Kenny King needs surgery on his right wrist and probably will miss the season, the latest hit to a team struggling with injuries.",1,Sports
Raptors Sign Center Loren Woods (AP) AP - The Toronto Raptors signed free agent center Loren Woods on Wednesday.,1,Sports
Heavy Rains Wash Out Mets-Rockies Game (AP) AP - Heavy rains washed out Wednesday night's game between the New York Mets and the Colorado Rockies before it ever started.,1,Sports
"Venezuela Opposition Refuses Recall Audit (AP) AP - Maintaining that a failed referendum to oust Venezuela's president was rigged against them, opposition leaders Wednesday refused to participate in a partial audit of the results as proposed by former President Jimmy Carter.",0,World
"Bush Says Importing Medicines 'Makes Sense' if Safe (Reuters) Reuters - President Bush, facing growing\anger among senior citizens over the high cost of prescription\drugs and a virtual revolt by some states, conceded on\Wednesday it ""makes sense"" for Americans to be able to import\cheaper medicines as long as they are safe.",0,World
"Ghana election draws strong turnout Snaking lines of hundreds of voters built up at balloting places across Ghana on Tuesday, as the first sub-Saharan country to gain independence voted for president.",0,World
" #39;The world is more dangerous #39; The war on terror has made the world a more dangerous place, Pakistan #39;s president has said. General Pervez Musharraf said the world was  quot;absolutely quot; less safe, because the war was not addressing the causes of terrorism.",0,World
"Finnish Students Rank #1 in the World Which country has the smartest students in the world? According to a study conducted by the Organization for Economic Co-Operation and Development, pupils in Finland tested higher than those in any other country.",0,World
"Australia  amp; New Zealand Aug. 18 (Bloomberg) -- Andrew Mohl (left), chief executive of AMP Ltd., talks with Bloomberg #39;s Kevin Foley in Sydney about first-half profit, investment fees and the strategy for its 10-percent stake in HHG Plc. AMP, Australia #39;s largest life insurer, ...",2,Business
Nortel #39;s Accounting Under Investigation Nortel Networks is under investigation by the Royal Canadian Mounted Police for irregularities in past accounting practices. Announcement of the investigation -- two days before its release of first- and second-quarter financials -- caused ...,2,Business
"Freddie Mac faces SEC action LOS ANGELES (Reuters) - Freddie Mac, the No. 2 US mortgage finance company, said Wednesday it may face civil action from the Securities and Exchange Commission for possible violations of securities laws. ",2,Business
"Bank of England Should Take a Breather at 4.75 Aug. 19 (Bloomberg) -- It #39;s time for the Bank of England to take a breather, chill out and learn to stop worrying about the ghost of inflation past. ",2,Business
"Ford Drops Oracle-based Purchasing System Ford Motor Co. on Wednesday said it has scrapped a five-year-old project to move suppliers over to an Internet-based purchasing system powered by Oracle software, deciding instead to revert back to its custom-built ...",3,Sci_Tech
Seiko Epson unveils latest mini robot helicopter Japanese company Seiko Epson says it has developed a mini helicopter that is the lightest of its kind and can be used for lifesaving and surveillance. ,3,Sci_Tech
Hamm bounces back after fall to talke gymnastic gold A fall on his vault landing sent Hamm stumbling into the judges #39; table and all the way down to 12th place in the all-around gymnastics final. ,1,Sports
Team GB Hoping for More Olympic Success Team GB will be hoping for more of the same at the Olympics today after finally delivering on the big stage with a four-medal haul. ,1,Sports
"Paes-Bhupathi overcome injury scare and Federer Athens, Aug 19. (PTI):Leander Paes and Mahesh Bhupathi overcame an injury scare and world number one singles #39; player Roger Federer of Switzerland to advance to the quarterfinals of the men #39;s doubles tennis event at the Olympic Games here on Wednesday. ",1,Sports
"Al-Sadr agrees to peace plan BAGHDAD, Iraq - Radical Shiite Muslim cleric Muqtada al-Sadr, whose militia has been fighting American and Iraqi forces for almost two weeks in Najaf, agreed Wednesday to a peace plan proposed by an Iraqi national ...",0,World
"Barghouti may be ready to quit PA race Jailed Fatah leader Marwan Barghouti may be close to withdrawing from the race for Palestinian Authority president. Hatem Abdel Kader, a member of Fatah #39;s ",0,World
"Bush speaks of 'Soviet dinar' in speech about Iraq (AFP) AFP - US President George W. Bush spoke of ""the Soviet dinar,"" even though dinars are the Iraqi currency.",0,World
"Google Lowers Expectations for Its Value (AP) AP - Google Inc. dramatically lowered expectations for the Internet search giant's value Wednesday ahead of its much ballyhooed coming out party in the public markets. The offering is still one of the biggest and highly anticipated for an Internet company, surpassing the hot issues of the dot-com boom.",3,Sci_Tech
"End of the line for HP's Alpha The last processor of the chip family is due Monday, signaling the end of a dynasty that never was.",3,Sci_Tech
"Hamm Wins All-Around Gymnastics Title (AP) AP - With his medal hopes all but gone after he hit the judges' table on his vault landing, Paul Hamm performed two of the most spectacular routines of his career to win the men's all-around gymnastics title by the closest Olympics margin ever.",1,Sports
"Iraq Cleric Agrees to End Uprising, Fighting Rages On (Reuters) Reuters - A radical Iraqi cleric leading a\Shi'ite uprising agreed on Wednesday to disarm his militia and\leave one of the country's holiest Islamic shrines after\warnings of an onslaught by government forces.",0,World
"Wen Ho Lee Reporters Held in Contempt (AP) AP - A federal judge held five reporters in contempt Wednesday for refusing to identify their sources for stories about Wen Ho Lee, a former nuclear weapons scientist once suspected of spying.",0,World
"Sharon's Party Rebels, Imperils Gaza Pullout Plan  JERUSALEM (Reuters) - Israeli Prime Minister Ariel Sharon's  Likud party has dealt a serious setback to his plan to evacuate  occupied Gaza by voting to bar him from forging a broad  coalition with the Labour opposition.",0,World
Mozilla launching second act with e-mail client Editor #39;s Summary: The Mozilla Foundation has followed up on the recent success of its Firefox browser with a new open source e-mail client.,3,Sci_Tech
"IMlogic unveils IM, P2P threat-detection network DECEMBER 07, 2004 (COMPUTERWORLD) - IMlogic Inc. and several partners today unveiled a new instant messaging  quot;threat center quot; clearinghouse aimed at fighting IM viruses, malicious software code and spam before they occur.",3,Sci_Tech
"Delta turnaround plan to include job cuts Delta Air Lines #39; much-awaited turnaround plan will include more job cuts at the ailing carrier, along with pay and benefits changes. ",2,Business
"Firewall Protection Without the Conflicts . I understand that Microsoft #39;s Service Pack 2 for Windows XP, a new update, includes improved firewall protection. I currently use Norton Personal Firewall; will any incompatibility result when both firewalls are installed, and is one ...",3,Sci_Tech
"Worst-case scenario comes to pass for US tennis Second-ranked Andy Roddick overplayed this summer and hasn #39;t scored a big win since March and for the first time since she became a legitimate pro, four-time Grand Slam champion Venus Williams has become vulnerable to anyone inside of the top 40. ",1,Sports
Americans Smash Last East German Swim World Record ATHENS (Reuters) - The last long-course world swimming record held by now discredited Communist East Germany was finally consigned to history by an American quartet at the Olympics on Wednesday. ,1,Sports
"Expos #39; Move Remains Undecided ommissioner Bud Selig #39;s three-year contract extension, the start of a television network and a World Cup tournament are likely to gain overwhelming approval from baseball #39;s owners this week, while a decision on the future home of ...",1,Sports
Montreal end Giants run Montreal Expos ended the San Francisco Giants #39; six-game winning streak with a 6-2 victory on Wednesday. ,1,Sports
"Arafat admits he has made many mistakes Yasser Arafat, the Palestinian leader, issued an unprecedented mea culpa yesterday, admitting that he had made mistakes and promising to rectify them. ",0,World
"Nepal closes for business as Maoist blockades cut off capital Threats from Maoist rebels in Nepal brought business in the Himalayan kingdom to a halt yesterday, as traffic blockades kept supplies from the capital, Kathmandu. There is only about 10 weeks #39; worth of food in the city, and many travellers ...",0,World
"Typhoon lashes southern Japan; 8 dead TOKYO -- Heavy rain fueled by a typhoon lashed southern Japan, leaving eight people dead and causing landslides and blackouts, officials said Thursday. Two people were missing. ",0,World
"Regulators to Widen Mutual Fund Probe (Reuters) Reuters - Misconduct in the U.S. mutual fund\industry is not limited to fund share trading; it's not even\limited to funds, say market regulators.",2,Business
"Third-Quarter Productivity Slows to 1.8 The productivity of America #39;s workers grew at a 1.8 percent annual rate in the third quarter, the slowest pace in nearly two years, the government reported Tuesday.",2,Business
"Lindows postpones IPO indefinitely Lindows, the Linux-based software developer best known for its legal battles with Microsoft Corp., has indefinitely shelved its plans to become a publicly traded company due to ""current adverse market conditions,"" it announced Wednesday.",3,Sci_Tech
"Credit Suisse to merge CSFB Credit Suisse Group, Switzerland #39;s second-biggest bank, plans to combine its Credit Suisse First Boston (CSFB) securities unit with its banking business in the next two years to boost earnings.",2,Business
"Sharon seeks support for planned coalition; Gaza violence kills &lt;b&gt;...&lt;/b&gt; JERUSALEM (AFP) - Israeli Prime Minister Ariel Sharon tried to rally support for the building of a new coalition to implement his planned pullout from Gaza, where two Palestinian militants and an Israeli soldier were killed in a new upsurge of violence.",0,World
"The Investment Column: BHP buoyed by China recovery Like the big oil companies, the world #39;s mining majors are experiencing an embarrassment of riches due to very high commodity prices. BHP Billiton is in the happiest position: it is both the world #39;s biggest miner and has a substantial oil production ...",2,Business
"Barclays buys US credit card firm Barclaycard, the UK #39;s largest credit card provider, moved closer to making its first steps in the US market yesterday as its parent group, Barclays, snapped up Juniper Financial Corporation, the North American consumer credit firm, for ...",2,Business
"Medtronic Net Up on Higher ICD Sales CHICAGO (Reuters) - Medtronic Inc. (MDT.N: Quote, Profile, Research) on Wednesday said its quarterly earnings rose on surprisingly brisk demand for devices that slow racing heartbeats, offsetting a weaker-than-expected performance in some ...",2,Business
"End of the line for HP #39;s Alpha Hewlett-Packard will release its final Alpha processor on Monday, the beginning of the end for a chip dynasty that never was. ",3,Sci_Tech
