"Winn-Dixie Posts Loss But Sees Progress  NEW YORK (Reuters) - Grocer Winn-Dixie Stores Inc. &lt;A HREF=""http://www.investor.reuters.com/FullQuote.aspx?ticker=WIN.N target=/stocks/quickinfo/fullquote""&gt;WIN.N&lt;/A&gt;  on Thursday reported a quarterly loss as restructuring costs  weighed on results, but said its efforts to reverse a market  share slide are gaining momentum.",2,Business
"Limited 2nd-Quarter Earnings Climb  NEW YORK (Reuters) - Clothing retailer Limited Brands Inc.  &lt;A HREF=""http://www.investor.reuters.com/FullQuote.aspx?ticker=LTD.N target=/stocks/quickinfo/fullquote""&gt;LTD.N&lt;/A&gt; on Thursday posted a sharply higher quarterly profit,  lifted by a rise in sales at stores open at least a year.",2,Business
Drug 'could boost malaria fight' Scientists develop a synthetic version of a herb-based drug to treat malaria.,3,Sci_Tech
"Climate legacy of 'hockey stick' A chart of temperature variation over 1,000 years dubbed the ""hockey stick"" has entered into the folklore of climate scientists, but how accurate is it?",3,Sci_Tech
"Better times for techies? Unemployment drops, optimism rises for computer professionals. Is it because the unhappy ones leave the field?",3,Sci_Tech
"Hall, Lezak Qualify in Olympic 50 Free (AP) AP - American Gary Hall Jr., the defending Olympic champion, and teammate Jason Lezak qualified for the 50-meter freestyle semifinals Thursday, but two of their biggest rivals failed to advance.",1,Sports
Possible Eighth Medal Chance for Phelps  ATHENS (Reuters) - Michael Phelps's chances of winning a  record eight medals at the Athens Olympics were given a big  boost on Thursday when U.S. team officials said he might swim  the heats of the 4x100 medley relay.,1,Sports
"Dutch Snatch Hockey Win, Pakistan Stun Korea  ATHENS (Reuters) - Olympic champions the Netherlands  snatched another last-minute victory on Thursday in the men's  hockey tournament in Athens and Pakistan stunned Sydney silver  medallists South Korea 3-0 with fast-paced, attacking hockey.",1,Sports
"Rebuffed by Party, Sharon Presses on with Gaza Plan  JERUSALEM (Reuters) - Israeli Prime Minister Ariel Sharon  vowed on Thursday to press ahead with his Gaza pullout plan  despite his own party's humiliating rebuff of his bid to forge  a coalition with the pro-withdrawal Labour Party.",0,World
Israel's Top Court Upholds Dropping of Sharon Case  JERUSALEM (Reuters) - Israeli Prime Minister Ariel Sharon  on Thursday won a final reprieve from criminal prosecution in a  bribery scandal that had threatened to topple him and derail  his plan to withdraw from the Gaza Strip.,0,World
"Torrential British Rain Set to Cause More Chaos  LONDON (Reuters) - After torrential rain caused flash  flooding in southern England and a landslide in Scotland this  week, meteorologists on Thursday forecast more heavy downpours  and urged people to heed bad weather warnings.",0,World
China protesters threaten suicide \Six Chinese protesters have threatened to jump from the top of a six-storey building in central Beijing.,0,World
Stocks Set to Open Slightly Lower at Open NEW YORK - U.S. stocks are seen slightly lower at the open Thursday as investors take some cash off the table after Wednesday's sharp rally...,0,World
"Jury in Peterson Trial Gets Long Weekend REDWOOD CITY, Calif. - Jurors in the Scott Peterson murder trial got an early start on their weekend when the judge delayed cross-examination of the prosecution's star witness, then sent them home because of what he described as a ""potential development.""   Judge Alfred A...",0,World
"Iraq Says Offensive Vs. Cleric to Start NAJAF, Iraq - An Iraqi Cabinet minister said Thursday that Iraqi forces could begin an offensive against Muqtada al-Sadr within hours, despite the firebrand cleric's acceptance of a peace proposal.    To prevent an imminent attack on his forces, who are holed up in the revered Imam Ali Shrine in Najaf, al-Sadr must immediately disarm his Mahdi Army militia and hand over its weapons to the authorities, Minister of State Qassim Dawoud said...",0,World
"Google's IPO Price Set at \$85 Before Debut SAN JOSE, California - On the cusp of its voyage into public trading, Google's initial stock price was set at \$85 and its market value calculated at \$23 billion - less than originally expected, but still impressive for a 6-year-old dot-com dreamed up in a garage.    The final initial public offering price, set through an unorthodox auction that alienated many on Wall Street, means the stock will likely debut Thursday under the symbol ""GOOG"" on the Nasdaq Stock Market...",0,World
"A broken record: Oil up again New market set as demand in China, India intensifies supply worries, Iraq lends price support. NEW YORK (CNN/Money) - Oil prices blazed past \$47.50 a barrel and set fresh highs early Thursday as demand growth in China and India exacerbated supply shortage ...",2,Business
"HK conglomerate Hutchison #39;s first half net profit up 106 percent HONG KONG : Hutchison Whampoa, the ports-to-telecoms conglomerate owned by Hong Kong tycoon Li Ka-shing, reported its first half net profit rose 106 percent to HK\$12.5b (US\$1.6b). ",2,Business
"NetApp posts profits, continues hiring spree Network Appliance posted positive results for its first quarter of 2005 on Wednesday, reporting a 38 percent increase in revenue compared to the same quarter last year, and said it intends to continue hiring 200 new people a quarter. ",3,Sci_Tech
Possible Eighth Medal Chance for Phelps ATHENS (Reuters) - Michael Phelps #39;s chances of winning a record eight medals at the Athens Olympics were given a big boost on Thursday when US team officials said he might swim the heats of the 4x100 medley relay. ,1,Sports
"India weightlifter tests positive An Indian weightlifter has tested positive for drugs before the start of the Athens Games, the International Olympic Committee has announced. ",1,Sports
"French to appeal after losing gold ATHENS, Greece (AP) -- The French Olympic team is to appeal to the Court of Arbitration for Sport to try to win back its three-day event Olympic gold medal in Athens. ",1,Sports
Supporters now have to wait to see Nunez HE #39;S the man seem-ingly no-one in Liverpool knows anything about - and who #39;ll now have to wait a little longer before attempting to endear himself to a curious Anfield crowd. ,1,Sports
"Ching gains repemption, his goal in 89th minute earning 1-1 qualifying draw in Jamaica. KINGSTON, Jamaica (Wednesday, August 18, 2004) -- Brian Ching was not one to waste a second chance. The reserve striker, who earlier missed an opportunity to tie the game with a point-blank header, made no mistake when he drove home a close-in shot in the ...",1,Sports
Iraqi Minister Sets New Deadline For Al-Sadr 19 August 2004 -- An Iraqi government official has said a military offensive against Shi #39;ite militiamen loyal to Shi #39;a cleric Muqtada al-Sadr in the holy city of Al-Najaf will begin in  quot;hours quot; unless they disarm. ,0,World
Georgia Says 6 Soldiers Killed in Latest Clashes in South Ossetia Georgian military officials say at least six Georgian soldiers have been killed and at least seven others wounded in overnight clashes in Georgia #39;s breakaway region of South Ossetia. ,0,World
"UK #39;s Blair Alters Holiday After Sardinian Bombs, Corriere Says Aug. 19 (Bloomberg) -- UK Prime Minister Tony Blair has changed his holiday plans following Wednesday #39;s discovery of two explosive devices near Italian Prime Minister Silvio Berlusconi #39;s Sardinian villa, where he had been staying, Il Corriere della Sera ...",0,World
"UN Marks Anniversary of Bombing of Baghdad Mission The United Nations is marking the first anniversary of the bombing of UN headquarters in Baghdad that killed 22 people, including the world body #39;s top envoy to Iraq Sergio Vieira de Mello. ",0,World
Oil Hits New Record as Demand Soars  LONDON (Reuters) - Oil prices struck a fresh record high  above \$47.50 a barrel on Thursday as fresh evidence of demand  growth in China and India underlined how rising appetite for  oil is straining the world's supply system.,2,Business
"Blast Hits Heavily Fortified Baghdad Area (AP) AP - An explosion Thursday hit the heavily fortified Green Zone, home to Iraqi government offices and the U.S. Embassy in central Baghdad, sending up a plume of gray smoke.",0,World
"Toshiba, Memory-Tech Develop New DVD (AP) AP - Two Japanese companies said Tuesday they have developed a DVD that can play on both existing machines and the upcoming high-definition players, raising hopes for a smooth transition as more people dump old TV sets for better screens.",3,Sci_Tech
"Before-the-Bell: Synopsys Shares Drop (Reuters) Reuters - Shares of Synopsys Inc. (SNPS.O), a\semiconductor design software maker, tumbled before the bell on\Thursday, a day after the company reported lower quarterly net\income and said results in the current quarter would be below\Wall Street estimates.",2,Business
Asia feels the pain of oil prices Governments around the region are warning that rising oil prices have started to hurt their economies.,2,Business
Net firms set sights on spammers British net firms are starting to get tough with firms that drum up trade using junk e-mails.,3,Sci_Tech
Princess Anne in Cyprus to encourage Olympic competitors (AFP) AFP - Princess Anne was in Cyprus to pay a royal morale-boosting visit to Britain's Olympic athletes training on the Mediterranean island before heading off to the Athens Games.,0,World
Virgin plans China mobile expansion Virgin Group today announced plans to expand its mobile phone services to China in a \$300m (154m) joint venture with a Chinese company.,2,Business
"DaVita to buy dialysis clinics for \$3.05 billion The Swedish company Gambro AB will sell a division to an El Segundo company for \$3.05 billion in cash. Gambro Healthcare US, the division being sold, operates clinics for patients undergoing kidney dialysis and has 565 clinics and 43,200 patients.",2,Business
"Job Cuts Rise Further in Nov. - Report Planned job cuts at US firms climbed during November, a report said on Tuesday, in a further sign of sluggishness in the labor market.",2,Business
"More Web Shopping Is What #39;s in Store The retail sector overall may be reporting a sluggish start to the season, but holiday shoppers are scooping up iPods, DVDs, digital cameras and other tech goods at a brisk pace -- and they ",2,Business
"Nortel Reports Preliminary Results (Reuters) Reuters - Nortel Networks Corp. (NT.TO) delivered\long-awaited preliminary results for the first half of 2004 on\Thursday that showed estimated first and second quarter\earnings between nil and 1 cent per share, and North America's\biggest telecom equipment supplier said it would cut about\3,500 jobs.",2,Business
"Limited Quarterly Earnings Climb  NEW YORK (Reuters) - Clothing retailer Limited Brands Inc.  &lt;A HREF=""http://www.investor.reuters.com/FullQuote.aspx?ticker=LTD.N target=/stocks/quickinfo/fullquote""&gt;LTD.N&lt;/A&gt; on Thursday posted sharply higher quarterly earnings on  gains from the sale of its stake in Galyans Trading Co. and  strong customer response to sales events early in the quarter.",2,Business
"Ciena Posts Loss, Forecasts Flat Sales  NEW YORK (Reuters) - Telecommunications equipment maker  Ciena Corp. &lt;A HREF=""http://www.investor.reuters.com/FullQuote.aspx?ticker=CIEN.O target=/stocks/quickinfo/fullquote""&gt;CIEN.O&lt;/A&gt; on Thursday reported a wider loss for the  fiscal third quarter due to slack demand and forecast sales in  the current quarter would be little changed from the third  quarter.",2,Business
Dollar Struggles to Stay Off Lows  LONDON (Reuters) - The dollar traded near this week's  four-week lows against the euro and yen on Thursday ahead of  U.S. jobless claims and a key business survey that dealers  expect to provide further clues about the interest rate  outlook.,2,Business
"Groups Chide U.S. on Mercury Regulations (AP) AP - Environmentalists and two Maryland Democratic congressmen chastised the Bush administration Wednesday for proposed regulations they said will not do enough to reduce mercury contamination of Maryland rivers, lakes and the Chesapeake Bay.",3,Sci_Tech
"Group: New England Not Reducing Mercury (AP) AP - If environmental policy were scored like grade-school spelling tests, New England's mercury reduction efforts wouldn't get any gold stars.",3,Sci_Tech
WTC destruction was two occurrences: jury World Trade Center leaseholder Silverstein Properties Inc. could collect \$4.68 billion in insurance payments after the jury in the second phase of the WTC property insurance litigation decided that the Sept.,2,Business
"Update 25: Google #39;s IPO Price Set at \$85 Before Debut On the cusp of its voyage into public trading, Google #39;s initial stock price was set at \$85 and its market value calculated at \$23 billion - less than originally expected, but still impressive for a 6-year-old dot-com dreamed up in a garage. ",2,Business
"Claire #39;s 2Q Earnings Are Up 48 Percent Jewelry and accessories retailer Claire #39;s Stores Inc. reported Thursday that second-quarter earnings rose 48 percent to beat Wall Street expectations, and guided above estimates for the fourth-quarter and fiscal year periods. ",2,Business
"Google cuts price range, ends auction SAN JOSE, California - Initial shares of Google Inc. were priced late last night at \$85 US each -- the low end of estimates that the company had revised downward hours earlier. ",2,Business
"Swisscom confirms Telekom Austria talks have ended ZURICH, Aug 19 (Reuters) - Top Swiss telecoms group Swisscom (SCMN.VX: Quote, Profile, Research) confirmed takeover talks with neighbouring Telekom Austria (TELA.VI: Quote, Profile, Research) had ended without result, the group said on Thursday, crushing ...",2,Business
"US broadband reaches critical mass Over half of online US households are using broadband to access the internet, according to new research. ",3,Sci_Tech
"Six of Top Eight Music Players In Japan Are iPods The AP is reporting that the iPod has become so popular in Japan, despite the introduction of the Sony Walkman NW-HD1, that six of the top 8 selling music players in the country are iPod models. The AP ...",3,Sci_Tech
"Microsoft unveils Works 8 The dictionary module has been integrated into the word processor and is also a stand-alone application in the Works Task Launcher. A thesaurus has been included, as well as the option to set parental controls. ",3,Sci_Tech
"Forget the medal count, Phelps has far exceeded expectations Two-time US Olympian Tom Dolan, who took back-to-back gold medals in the 400 IM at Atlanta and Sydney, will analyze races for SI.com throughout the Games. ",1,Sports
"Greek stars fan scandal #39;s flames by withdrawing ATHENS - On a day on which both Greece and the Olympics celebrated themselves by returning the Games to their ancient home in Olympia, two popular Greek athletes withdrew from the track and field competition amid a scandal befitting that ...",1,Sports
"Americans fall on tennis court A US tennis team expected to collect a gold rush or at least challenge for one, instead got derailed just after coming out of the gate. ",1,Sports
"Figo has a break from international soccer match LISBON, Aug. 18 (Xinhuanet) -- Portugal captain Luis Figo said here on Wednesday he was taking a break from international soccer, although he would not confirm if the decision was final. ",1,Sports
Retailer's Share Up on Wal-Mart Interest (AP) AP - Shares of Japan's troubled supermarket chain Daiei Inc. soared 27 percent Thursday following reports that U.S. giant Wal-Mart Stores Inc. planned to submit a proposal for turning the company around.,2,Business
"Amazon to Buy China's Biggest Internet Retailer (Reuters) Reuters - Internet giant Amazon.com Inc. is to\buy China's biggest online retailer, Joyo.com, sources familiar\with the deal said on Thursday.",3,Sci_Tech
"Soap Chemical Said Found in Md. Streams (AP) AP - An anti-bacterial agent commonly found in soaps and detergents has been found in water from streams and wastewater treatment plants in the Baltimore area, a Johns Hopkins researcher said Wednesday.",3,Sci_Tech
N.M. Museum to Launch Names Into Space (AP) AP - The New Mexico Museum of Space History will be shipping names to the stars with the first X-Prize launch into space.,3,Sci_Tech
Update: Google gets IPO green light from SEC The U.S. Securities and Exchange Commission (SEC) on Wednesday gave its approval for Google Inc. to proceed with its initial public offering (IPO).,3,Sci_Tech
"Gateway unveils Grantsdale PCI Express PCs in retail Gateway Inc. will introduce its first desktops based on Intel Corp.'s new 915G chip set through several retail outlets, the company plans to announce Thursday.",3,Sci_Tech
"Intel Chips In for New Gateway PCs Desktops will be available at several retailers, including CompUSA.",3,Sci_Tech
"Lawsuit Filed Over Search   Gambling Ads Yahoo, Google and other major web sites have been hit with a lawsuit saying they carry online gambling ads in violation of California law. This comes after two of the major search companies earlier this year made moves that were supposed to remove online gambling ads entirely.",3,Sci_Tech
"Nortel to Cut 3,500 Jobs to Boost Profit  OTTAWA (Reuters) - Nortel Networks Corp. &lt;A HREF=""http://www.investor.reuters.com/FullQuote.aspx?ticker=NT.TO target=/stocks/quickinfo/fullquote""&gt;NT.TO&lt;/A&gt; &lt;A HREF=""http://www.investor.reuters.com/FullQuote.aspx?ticker=NT.TO target=/stocks/quickinfo/fullquote""&gt;NT.TO&lt;/A&gt;  posted long-awaited preliminary results for the first half of  2004 on Thursday, estimating first and second quarter earnings  between nil and 1 cent per share.",2,Business
"Oil Sets Record as New Violence Flares in Iraq  LONDON (Reuters) - Oil prices struck a fresh record on  Thursday, spurred higher by renewed violence in Iraq and fresh  evidence that strong demand growth in China and India has not  been slowed yet by higher energy costs.",2,Business
"Global Markets: Stocks Up Despite Oil  LONDON (Reuters) - European stocks shrugged off new peaks  in crude oil prices and moved slightly higher on Thursday with  technology firms leading the advance, while bonds and the  dollar were steady.",2,Business
"Ky. Park, Univ. Open Cave Learning Center (AP) AP - Mammoth Cave National Park and Western Kentucky University have opened a facility that is designed to give students a hands-on learning environment in the longest known cave system in the world.",3,Sci_Tech
"Retail sales fall in July Retail sales fell 0.4 in July - the first monthly decline in over a year - but the underlying trend remains strong, official figures showed today. ",2,Business
"Google #39;s IPO Price Set at \$85 Before Debut SAN JOSE, California (AP)--On the cusp of its voyage into public trading, Google #39;s initial stock price was set at \$85 and its market value calculated at \$23 billion--less than originally expected, but still impressive for a 6-year-old dot-com ...",2,Business
"Microsoft downplays XP SP2 flaw claims Microsoft has won the first round against security researchers digging for flaws in its Windows XP Service Pack 2 (SP2), dismissing claims by German consultants to have identified vulnerabilities. ",3,Sci_Tech
Technical breakthrough boosts Broadband Britain Broadband should be available through 99.4 per cent of phone lines by next summer thanks to a technical breakthrough by BT. ,3,Sci_Tech
"Israeli High Court upholds decision over Sharon graft case JERUSALEM, Aug. 19 (Xinhuanet) -- Israeli High Court of Justice upheld Thursday Attorney General Menachem Mazuz #39;s decision not to indict Prime Minister Ariel Sharon in the Greek island corruption case, Haaretz website reported. ",0,World
"Two Polish Soldiers Killed In Iraq Avoiding Ambush WARSAW, Aug 19 (AFP) - Two Polish soldiers serving in Iraq were killed and five injured on Thursday in a car crash as they sought to escape an ambush, a military spokesman in Warsaw said. ",0,World
"Navistar Results Rise on Truck Demand  CHICAGO (Reuters) - Commercial truck maker Navistar  International Corp. &lt;A HREF=""http://www.investor.reuters.com/FullQuote.aspx?ticker=NAV.N target=/stocks/quickinfo/fullquote""&gt;NAV.N&lt;/A&gt; said on Thursday quarterly earnings  rose as it boosted sales and controlled costs.",2,Business
"Basketball: Americans Behind Again at Halftime  ATHENS (Reuters) - The U.S. men's basketball team were once  again in danger of defeat at the Olympic tournament on  Thursday, trailing Australia 51-47 at the end of the first  half.",1,Sports
"Doping Casts Shadow Over Olympics -- Again  ATHENS (Reuters) - Five weightlifters were banned from the  Olympics after failing drugs tests, officials said on Thursday,  as doping scandals continued to dominate the first week of the  Games.",1,Sports
UK Police Arrest One Man Under Anti-Terror Laws (Reuters) Reuters - Police arrested a man in central England\on Thursday under anti-terrorism laws.,0,World
Ex-Chess Champ Fischer's Marriage Plans Hit Snag  TOKYO (Reuters) - A Japanese chess great who plans to marry  former world champion Bobby Fischer and help him avoid  deportation home to the United States declared herself on  Thursday to be a pawn seeking to become a queen.,0,World
"Gay Couples Plan to Appeal Mass. Ruling BOSTON - A state judge upheld a 1913 law that prohibits out-of-state gay couples from marrying in Massachusetts, where same-sex marriage between residents has been legal since May.    The eight couples who filed the lawsuit - from Connecticut, Rhode Island, New Hampshire, Vermont, Maine and New York - sought a preliminary injunction blocking enforcement of the statute, claiming it is inherently discriminatory...",0,World
"Jobless Claims Dip, No Storm Effect (Reuters) Reuters - The number of Americans filing first\claims for jobless pay fell 3,000 last week, the Labor\Department said on Thursday in a report showing no impact from\Hurricane Charley which struck Florida last Friday.",2,Business
"Jobless Claims Dip, No Storm Effect  WASHINGTON (Reuters) - The number of Americans filing first  claims for jobless pay fell 3,000 last week, the Labor  Department said on Thursday in a report showing no impact from  Hurricane Charley which struck Florida last Friday.",2,Business
"Oil Sets Record Amid New Violence in Iraq  LONDON (Reuters) - Oil prices struck a fresh record on  Thursday, spurred higher by renewed violence in Iraq and fresh  evidence that strong demand growth in China and India has not  been slowed yet by higher energy costs.",2,Business
"Before-the-Bell: Synopsys, DeVry Fall  NEW YORK (Reuters) - Shares of DeVry Inc. &lt;A HREF=""http://www.investor.reuters.com/FullQuote.aspx?ticker=DV.N target=/stocks/quickinfo/fullquote""&gt;DV.N&lt;/A&gt;, a  provider of business and technical education, fell before the  bell on Thursday, a day after it reported fourth-quarter  earnings that came in just shy of analysts' expectations.",2,Business
"Swisscom, Austrian telecom talks cut off: OeIAG (AFP) AFP - Negotiations between the Austrian privatisation agency OeIAG and the Swiss telecommunications group Swisscom for a stake in Telekom Austria ended without a deal, OeIAG said in a statement.",0,World
"Oil Sets Record as New Violence Flares in Iraq LONDON (Reuters) - Oil prices struck a fresh record on Thursday, spurred higher by renewed violence in Iraq and fresh evidence that strong demand growth in China and India has not been slowed yet by higher energy costs. ",2,Business
"Nortel to Cut 3,500 Jobs to Boost Profit OTTAWA (Reuters) - Nortel Networks Corp. (NT.TO: Quote, Profile, Research) posted long-awaited preliminary results for the first half of 2004 on Thursday, estimating first and second quarter earnings between nil and 1 cent per share. ",2,Business
"Stocks to Watch on Thursday, August 19 Clothing retailer Limited Brands, whose chains include the Limited, Express, Victoria #39;s Secret and Bath  amp; Body Works, posted a sharply higher quarterly profit on Thursday. The company saw a rise in sales at stores open at least a year. Its shares closed ...",2,Business
"Net nearly doubles, helped by stronger results at Hutchison HONG KONG Cheung Kong (Holdings), the holding company of the billionaire Li Ka-shing, said Thursday that first-half profit almost doubled, spurred by higher earnings from its Hutchison Whampoa unit and a surge in property sales. ",2,Business
"Parmalat to sue auditors PARMALAT, the bankrupt Italian food company, is suing outside auditors Grant Thornton and Deloitte  amp; Touche, seeking 5.5 billion in damages. ",2,Business
"Broadband Breaks 50 Of Mass, Marks A Critical Pass More than half (51) of the American online population accessed the Internet via broadband connections in July--up from only 38 percent in July 2003, according to estimates released Tuesday by Nielsen//NetRatings. ",3,Sci_Tech
"Micro Focus lifts and shifts Cobol to Linux Micro Focus has extended its  #39;Lift and Shift #39; legacy Cobol migration service, adding the option of migrating CICS-based mainframe Cobol applications to HP and IBM Unix and Linux servers. ",3,Sci_Tech
"Doping Casts Shadow Over Olympics -- Again ATHENS (Reuters) - Five weightlifters were banned from the Olympics after failing drugs tests, officials said on Thursday, as doping scandals continued to dominate the first week of the Games. ",1,Sports
"England soon lose opener Strauss LONDON, England (Reuters) -- England lost opener Andrew Strauss as they reached 53 for one at lunch on the first day of the fourth and final test against West Indies at The Oval. ",1,Sports
"Another slow start, another fast finish for US women South Korea took an early lead, so did the Czech Republic. Hey, even New Zealand had the US women #39;s basketball team down for a while. ",1,Sports
